{"actor":"codex","byte_size":7,"id":"66666666-6666-4666-8666-666666666666","inserted_at":"2026-07-16T12:34:56.123456Z","managed_path":"/private/autoboard/attachments/66666666-6666-4666-8666-666666666666","media_type":"text/plain","original_filename":"notes.txt","project_id":"11111111-1111-4111-8111-111111111111","sha256":"aaaaaaaaaaaaaaaaaaaaaaaaaaaaaaaaaaaaaaaaaaaaaaaaaaaaaaaaaaaaaaaa","ticket_id":"44444444-4444-4444-8444-444444444444"}
